{
  "$schema": "../../../../governance/schemas/local-governance.schema.json",
  "id": "rag",
  "kind": "backend-subsystem",
  "purpose": "Convert, chunk, embed, persist, retrieve, and rerank documents",
  "entrypoints": [
    "backend/app/api/routes/v1/rag.py",
    "backend/app/services/rag/ingestion.py",
    "backend/app/services/rag/retrieval.py"
  ],
  "owns": [
    "backend/app/services/rag/**",
    "backend/app/services/rag_sync.py",
    "backend/app/services/rag_document.py",
    "backend/app/services/rag_status.py"
  ],
  "public_interfaces": [
    "GET /api/v1/rag/search",
    "GET /api/v1/rag/status/stream",
    "POST /api/v1/rag/sync/sources/{source_id}/trigger"
  ],
  "invariants": [
    "Embedding dimension is 1024 end to end: settings EMBEDDING_DIMENSION, the vectorstore guard and DDL, the migration CHECK constraint, the persisted per-collection embedding_fingerprint, and the embedding cache key version. Drift between any two of the five is the finding, not just a mismatch against settings",
    "Re-ingestion preserves stable document identity, so re-running a sync updates a document rather than duplicating it",
    "The embedding cache is two-level: Redis L1 backed by a durable PostgreSQL pgvector L2 with versioned keys. Changing what the key hashes invalidates both levels and is part of the dimension contract",
    "Ingestion and chat uploads reach Docling Serve over the direct HTTP client; the docling-mcp sidecar is an agent tool source, not this path. Both must resolve to the same DOCLING_SERVE_URL with compatible timeout and retry budgets",
    "The general and RAG object-storage buckets stay distinct, with separate credentials and endpoints"
  ],
  "allowed_dependencies": [
    "docling-serve",
    "minio",
    "model-runner-host",
    "postgres-pgvector",
    "redis"
  ],
  "forbidden_dependencies": [
    "frontend-app",
    "chat-frontend"
  ],
  "configuration_refs": [
    "S3_RAG_ENDPOINT",
    "S3_RAG_BUCKET",
    "S3_RAG_ACCESS_KEY",
    "S3_RAG_SECRET_KEY",
    "EMBEDDING_MODEL",
    "EMBEDDING_DIMENSION",
    "EMBEDDING_BASE_URL",
    "EMBEDDING_CACHE_URL",
    "RERANKER_BASE_URL",
    "CROSS_ENCODER_MODEL",
    "DOCLING_SERVE_URL",
    "RAG_CHUNK_SIZE",
    "RAG_CHUNK_OVERLAP",
    "RAG_TOP_K",
    "RAG_DEFAULT_COLLECTION"
  ],
  "validation": [
    "backend-unit",
    "rag-docker-integration"
  ],
  "graph_hints": {
    "entry_symbols": [
      "ingest_document_task",
      "sync_single_source_task"
    ],
    "exclude": []
  }
}
